offer_id,offer_url,title,updated_time,price_change,days_active,price,cian_estimation,price_difference,price_difference_value,price_info,address,metro_station,neighborhood,district,description,price_change_value,distance,price_change_formatted
315392787,https://www.cian.ru/rent/flat/315392787/,"2-комн. квартира, 43 м², 4/9 этаж",2025-03-25 00:00:00,,1,90 000 ₽/мес.,99 000 ₽/мес,-9 000 ₽/мес.,-9000.0,"От года, комм. платежи включены (без счётчиков), комиссия 30%, залог 90 000 ₽","2-я Фрунзенская улица, 10",м. Фрунзенская,р-н Хамовники,ЦАО,"Сдается двухкомнатная квартира, состоящая из кухни-гостиной и отдельной просторной спальни. В кухне-гостиной: кухонный гарнитур, плита, вытяжка, холодильник, посудомоечная машина, СВЧ, вытяжной вентилятор, раскладывающийся стол, стулья, стеллаж с телевизором, шкафчики для вещей, диван-книжка, журнальный столик, кондиционер. В спальне: двуспальная кровать, две тумбочки, два вместительных платяных шкафа с зеркальным фасадом. Из спальни есть выход на балкон (не застеклен). Санузел: большой, совмещенный, облицован плиткой, ванна, стиральная машина-автомат с сушкой, водонагреватель, вытяжной вентилятор. В квартире выполнен качественный ремонт: плитка и ламинат на полу, пластиковые окна Rehau, москитные сетки, жалюзи от солнца. Все четыре окна выходят во двор. Закрывающийся тамбур на две квартиры. Пассажирский лифт, в подъезде свежий косметический ремонт. Отличная инфраструктура: в пешей доступности магазины, кафе, школы, поликлиника, Фрунзенская набережная, пешеходный мост в Парк Горького и Нескучный сад и т.д. Высокая транспортная доступность: всего 4-5 минут пешком до метро Фрунзенская, удобный заезд через Садовое и Третье транспортное кольцо, Фрунзенскую набережную и Комсомольский проспект. Для одного-двух человек, без животных.",,3.3555,new
315051677,https://www.cian.ru/rent/flat/315051677/,"1-комн. квартира, 45 м², 5/8 этаж",2025-03-25 00:00:00,,1,75 000 ₽/мес.,74 000 ₽/мес,1 000 ₽/мес.,1000.0,"От года, комм. платежи включены (без счётчиков), комиссия 70%, залог 75 000 ₽","улица Хамовнический Вал, 14",м. Спортивная,р-н Хамовники,ЦАО,"Просторная современная квартира с высокими потолками в районе Хамовники. В квартире есть всё необходимое для комфортного проживания. Посудомойка, холодильник ,2 кондиционера в комнате и на кухне, новая стиральная машинка , телевизор , много мест для хранения , и вся необходимая  мебель . Рядом с домом Фрунзенская набережная, развитый район в центре Москвы. Квартира свободна. Пригласим порядочных и платежеспособных граждан, без животных! Супер хозяйка не беспокоит. Оперативный показ и заселение. Звоните! договоримся",-3000.0,3.0184,-3 000 ₽/мес.
222723163,https://www.cian.ru/rent/flat/222723163/,"2-комн. квартира, 42 м², 2/12 этаж",2025-03-24 00:00:00,,3,80 000 ₽/мес.,76 000 ₽/мес,4 000 ₽/мес.,4000.0,"От года, комм. платежи включены (без счётчиков), комиссия 60%, залог 80 000 ₽","Малый Саввинский переулок, 5",м. Спортивная,р-н Хамовники,ЦАО,Котов не берём категорически! Собак рассматриваем!!! Наталия! Сдаю 2-х к квартиру в самом центре Москвы! Состояние после косметического ремонта! Окна с/ п! Есть все необходимое!  Комнаты изолированные- спальня и гостиная! Не заставлена лишней мебелью и коврами! Подьезд в хорошем состоянии!+ вода и эл-во! депозит разобьем! Есть возможность резиденской парковки!  Ключи на руках- покажу в любое время,5000.0,1.0904,5 000 ₽/мес.
314327404,https://www.cian.ru/rent/flat/314327404/,"1-комн. квартира, 35 м², 4/12 этаж",2025-03-24 00:00:00,,5,95 000 ₽/мес.,88 000 ₽/мес,-7 000 ₽/мес.,-7000.0,"От года, комм. платежи включены (без счётчиков), комиссия 35%, залог 95 000 ₽","Украинский бульвар, 8С1",м. Смоленская,р-н Дорогомилово,ЗАО,"Cдаeтся в дoлгоcрочную аренду блaгоуcтрoeнная однокомнатная квартира с дизайнерским ремонтом, которая идеально подойдет для молодой пары!
Для всех жильцов предоставляем: комплeктaцию бытовыми мeлочами - подушки, oдеялa, посудa, wi-fi, поддepжку пo бытовым вопpосам и тeкущeму pемoнту. Mы заботимся о вашем комфортном проживании.
Квартира расположена в районе Дорогомилово рядом со станцией метро Киевская, которая находится в 6 минутах пешей ходьбы. В непосредственной близости Трц Европейский, множество продуктовых магазинов, ресторанов и кафе, Москва Сити.
Стильное пространство для комфортного проживания оборудовано всем необходимым: удобная кровать, рабочее место с теплым освещением, вместительный шкаф, зеркало, стильный комод. Светлая кухня зонирована для комфортного проживания и отдыха.
Если у вас возникли какие-либо вопросы, вы всегда можете написать их нам в чат или позвонить по номеру телефона. Мы с радостью вам ответим!",-10000.0,4.12,-10 000 ₽/мес.
288005740,https://www.cian.ru/rent/flat/288005740/,"2-комн. квартира, 52 м², 1/8 этаж",2025-03-24 00:00:00,,0,90 000 ₽/мес.,88 000 ₽/мес,2 000 ₽/мес.,2000.0,"От года, комм. платежи включены (счётчики включены), комиссия 50%, залог 90 000 ₽","улица Хамовнический Вал, 38",м. Спортивная,р-н Хамовники,ЦАО,"Сдается отличная 2 х комнатная квартира в 2х минутах ходьбы от  м.Спортивная. Квартира после ремонта, очень чистая, аккуратная.Окна пластиковые, высокие потолки. На окнах есть решетки, расположена на 1м этаже.В квартире есть вся необходимая мебель и бытовая техника. Зеленый тихий двор, шлагбаум. Квартира свободна и готова к заселению .Рассмотрим порядочных и платежеспособных людей, семью  на длительный срок. Ждём ваших предложений.Оперативный показ.",-5000.0,1.9067,-5 000 ₽/мес.
295252797,https://www.cian.ru/rent/flat/295252797/,"1-комн. квартира, 29,2 м², 7/10 этаж",2025-03-23 00:00:00,,6,80 000 ₽/мес.,82 000 ₽/мес,-2 000 ₽/мес.,-2000.0,"От года, комм. платежи включены (без счётчиков), комиссия 50%, залог 80 000 ₽","1-й Вражский переулок, 4",м. Смоленская,р-н Хамовники,ЦАО,"Уютная угловая студия с окнами  в тихий зеленый двор.
В квартире теплые полы, бактерицидный очиститель воздуха и вся необходимая для проживания техника и посуда.
Территория двора закрытая, паркинг внутри и снаружи.
До метро Киевская 5минут пешком по пешеходному мосту.
Метро Смоленская и Парк Культуры в шаговой доступности.
Вся инфраструктура в этом же здании ( супермаркет, аптека, кафе,  химчистка), пункты доставки в соседнем здании.
Предпочтение для проживания отдается одному человеку без  детей и животных.
Для связи писать  в чат ЦИАН, не звонить.
Наш сотрудник Вам перезвонит по Whats Aрр, оставьте ваш контакт в Whats App в чате ЦИАН.


-----
Примечание: у собственника могут быть дополнительные пожелания к жильцам - обсудите их в чате или по телефону",-5000.0,2.086,-5 000 ₽/мес.
313492003,https://www.cian.ru/rent/flat/313492003/,"2-комн. квартира, 45 м², 7/13 этаж",2025-03-22 00:00:00,,7,73 000 ₽/мес.,82 000 ₽/мес,-9 000 ₽/мес.,-9000.0,"От года, комм. платежи включены (без счётчиков), комиссия 50%, залог 73 000 ₽","Малая Пироговская улица, 22",м. Спортивная,р-н Хамовники,ЦАО,"Сдается 2-комнатная квартира. Комнаты изолированные. Косметический ремонт. В спальне - двуспальная кровать, в гостиной - раскладной диван. Большая застекленная лоджия. Квартира укомплектована необходимой мебелью и техникой.",-2000.0,1.3874000000000002,-2 000 ₽/мес.
314886750,https://www.cian.ru/rent/flat/314886750/,"1-комн. квартира, 40 м², 5/9 этаж",2025-03-21 00:00:00,,0,75 000 ₽/мес.,62 000 ₽/мес,13 000 ₽/мес.,13000.0,"От года, комм. платежи включены (без счётчиков), комиссия 50%, залог 75 000 ₽","улица Хамовнический Вал, 10",м. Спортивная,р-н Хамовники,ЦАО,"Номер лота - 3519348
Гарантии компании. Сдается впервые!!!!  Сдается просторная , светлая квартира в самом лучшем районе Москвы. Хамовники. После косметического ремонта(кроме санузла ). Кухонный гарнитур со всей бытовой техникой, в том числе посудомоечная машина. Мебель современная. Есть все необходимое для комфортного проживания.Улучшения в квартире обсуждается  в счет месячной арендной платы. Большая застекленная лоджия. Развитая инфраструктура, рядом много супермаркетов, кафе, банки , Парк Лужники.Воробьевы горы в пешей доступности. Рассматриваем 1-2чел , строго без животных.

 ИНКОМ-Беляево.",-5000.0,3.0441,-5 000 ₽/мес.
272600208,https://www.cian.ru/rent/flat/272600208/,"Студия, 11 м², 1/5 этаж",2025-03-20 10:10:00,,16,50 000 ₽/мес.,56 000 ₽/мес,-6 000 ₽/мес.,-6000.0,"На несколько месяцев, комм. платежи включены (счётчики включены), без комиссии, залог 50 000 ₽","улица Усачева, 19АК2",м. Спортивная,р-н Хамовники,ЦАО,"Студия с мини-куxней, санузлом (душ, унитаз), маленькая, для проживания одного человека, работающего, без детей, животных, вредных привычек. Коммунальные расxоды включены в стоимость аренды. Залог - 1 месяц. Две соседние студии сданы. Агентам - не звонить.
-----
Примечание: у собственника могут быть дополнительные пожелания к жильцам - обсудите их в чате или по телефону",,2.02,new
315027467,https://www.cian.ru/rent/flat/315027467/,"1-комн. квартира, 29 м², 2/4 этаж",2025-03-20 00:00:00,,0,75 000 ₽/мес.,68 000 ₽/мес,7 000 ₽/мес.,7000.0,"От года, комм. платежи включены (без счётчиков), без комиссии, залог 75 000 ₽","улица Заморенова, 5С2",м. Смоленская,р-н Пресненский,ЦАО,"БЕЗ КОМИССИИ ДЛЯ АРЕНДАТОРА. Практичная однокомнатная квартира предлагается у станции метро ""Краснопресненская"". Планировка включает светлую кухню с практичным гарнитуром и лаконичную комнату, где, благодаря высоким потолкам, обустроена антресоль со спальным местом. Оборудован совмещенный санузел со стиральной машиной.

Поблизости расположились различные магазины, поликлиника, Московская экономическая школа, фитнес-клуб, музеи, зоопарк, парк Красная Пресня. Удобный выезд на Садовое кольцо и Новый Арбат - дополнительное преимущество для автолюбителей.

 - Страховой депозит можно оплатить 2-мя частями.
 - Квартиру представляет агент Capital Mars - Денис.
 - ID объекта 294873.",-5000.0,5.2505,-5 000 ₽/мес.
314939405,https://www.cian.ru/rent/flat/314939405/,"2-комн. квартира, 56,3 м², 8/10 этаж",2025-03-20 00:00:00,,0,95 000 ₽/мес.,117 500 ₽/мес,22 500 ₽/мес.,22500.0,"От года, комм. платежи включены (без счётчиков), комиссия 40%, залог 95 000 ₽","Кутузовский проспект, 4/2",м. Смоленская,р-н Дорогомилово,ЗАО,"Лот  63038 Сталинский дом. Квартира после ремонта, комнаты изолированные, с/у раздельный, укомплектована необходимой для комфортного проживания мебелью . Новый кухонный гарнитур, посудомоечная машина. Встроенные шкафы, чистый подъезд, консъеж.",-10000.0,4.4,-10 000 ₽/мес.
164708200,https://www.cian.ru/rent/flat/164708200/,"1-комн. квартира, 34 м², 6/8 этаж",2025-03-20 00:00:00,,0,60 000 ₽/мес.,70 000 ₽/мес,-10 000 ₽/мес.,-10000.0,"От года, комм. платежи включены (без счётчиков), комиссия 100%, залог 60 000 ₽","Комсомольский проспект, 11",м. Парк Культуры,р-н Хамовники,ЦАО,"Светлая, аккуратная и уютная квартира после косметического ремонта. Мебель наборная в отличном состоянии, свч, стиральная машина, кухонная утварь. Окна пвх, металлическая входная дверь. 

Роскошный вид из окна на соборы. Доброжелательные соседи. Тихий двор, приятный ландшафт во дворе.
Парковка спонтанная, двор под шлагбаум.

Рядом с домом развитая инфраструктура( продуктовые магазины, торговые центры, фитнес-центр, поликлиника). 

Дом находиться в 5 мин.пешком до Фрунзенской набережной и 10 мин.пешком до Парка Горького.

Длительный срок аренды. Без торга. Квартира сдается строго в том виде, что на фото. Клиенты с рвением внести свою дизайнерскую задумку в этот интерьер не тратьте свое и наше  время. 


Рассмотрим интеллигентных и платежеспособных клиентов.",,3.8321,new
271159992,https://www.cian.ru/rent/flat/271159992/,"1-комн. квартира, 30 м², 2/4 этаж",2025-03-20 00:00:00,,1,75 000 ₽/мес.,80 000 ₽/мес,-5 000 ₽/мес.,-5000.0,"От года, комм. платежи включены (без счётчиков), без комиссии, залог 75 000 ₽","улица Заморенова, 5С2",м. Смоленская,р-н Пресненский,ЦАО,"Светлая квартира со свежим ремонтом в современном стиле.
Закрытый зеленый и тихий двор, шлагбаум, охрана и видеонаблюдение.
Три больших окна выходят во двор.
Удобное расположение: в 3-5 мин. пешей доступности метро Краснопресненская и метро Баррикадная, удобная транспортная развязка (Садовое кольцо и ТТК).
Рядом расположены Правительство РФ, Правительство г.Москвы, Министерства, Посольства, Гостиница Украина, 2 больших парка, зоопарк, театры и рестораны.
Квартира МЕБЕЛИРОВАНА, вся необходимая бытовая техника европейских брендов - все новое.
Условия аренды:
1.Сдаётся на длительный срок.
2. Оплата ЖКХ
3. Депозит 1 месяц аренды
Оперативный показ
АГЕНТОВ ПРОСЬБА НЕ БЕСПОКОИТЬ!!!",5000.0,5.2505,5 000 ₽/мес.
314945210,https://www.cian.ru/rent/flat/314945210/,"1-комн. квартира, 30 м², 3/6 этаж",2025-03-19 13:01:00,,17,85 000 ₽/мес.,66 000 ₽/мес,19 000 ₽/мес.,19000.0,"На несколько месяцев, комм. платежи включены (счётчики включены), комиссия 30%, залог 30 000 ₽","улица Николаева, 1",м. Смоленская,р-н Пресненский,ЦАО,"Основные характеристики:

• Современный ремонт, выполненный с использованием качественных материалов.
• Полностью меблирована и укомплектована всей необходимой техникой.
• Функциональная планировка, обеспечивающая удобство проживания.

Преимущества:

• Удачное расположение и развитая инфраструктура.
• В шаговой доступности находятся магазины, кафе, рестораны, парки и другие объекты социальной инфраструктуры
• Удобная транспортная развязка, позволяющая быстро добраться до любого района Москвы
• Коммунальные услуги включены в стоимость аренды, что избавит вас от дополнительных расходов и хлопот
• Ежемесячная уборка входит в стоимость


Условия аренды:

• Возможность заселения в ближайшее время
• Депозит 30000

Эта квартира станет отличным выбором для тех, кто ценит комфорт, удобство и хорошее расположение. Не упустите шанс арендовать жильё, которое станет вашим уютным домом!

Для получения дополнительной информации и организации просмотра, свяжитесь с нами по указанному телефону.

Ждём ваших звонков или сообщений в вотсап!",-5000.0,4.122199999999999,-5 000 ₽/мес.
315118882,https://www.cian.ru/rent/flat/315118882/,"1-комн. квартира, 43 м², 6/12 этаж",2025-03-19 00:00:00,,3,90 000 ₽/мес.,82 000 ₽/мес,8 000 ₽/мес.,8000.0,"От года, комм. платежи включены (без счётчиков), комиссия 50%, залог 90 000 ₽","улица Льва Толстого, 7",м. Парк Культуры,р-н Хамовники,ЦАО,"С 1 МАЯ!!!!!! ПОКАЗ с 28 АПРЕЛЯ !!!! Сдаётся уютная однокомнатная квартира с хорошим ремонтом  в 9 минутах пешком от метро ""Парк Культуры"". Общая площадь квартиры — 43 кв. м, она расположена на 6 этаже 12-этажного дома. Окна выходят во двор, что обеспечивает тишину и комфорт.

В квартире есть всё необходимое для комфортного проживания: современная мебель на кухне и в комнате, а также полный комплект техники — холодильник, телевизор,  стиральная машина. Ванная комната оборудована душевой кабиной. С/у раздельный. 
Рядом  хорошие  школы, различные кафе, бизнес центры, рестораны, клиники, парки:  Усадьба Трубецких, Парк Новодевичьи Пруды, Нескучный сад,Фрунзенская набережная, Парк Горького . 
До метро Парк культуры и Фрунзенская можно дойти пешком . Это делает квартиру отличным выбором для семей и работающих людей. Удобная транспортная доступность позволяет быстро добраться до центра города.

Дом в хорошем состоянии, оснащен мусоропроводом. Для автомобилистов предусмотрена наземная парковка. Подключен интернет, поэтому всегда можно оставаться на связи.
 Возможна долгосрочная аренда с залогом. Квартира готова принять одного-двух жильцов. 

Приезжайте, записывайтесь на просмотр и оцените все преимущества жизни в этой прекрасной квартире!",,2.9634,new
