offer_id,offer_url,title,updated_time,price_change,days_active,price,cian_estimation,price_difference,price_difference_value,price_info,address,metro_station,neighborhood,district,description,price_change_value,distance,price_change_formatted
272591317,https://www.cian.ru/rent/flat/272591317/,"1-комн. квартира, 35 м², 2/5 этаж",2025-03-30 21:45:00,,5,70 000 ₽/мес.,73 000 ₽/мес,-3 000 ₽/мес.,-3000.0,"От года, комм. платежи включены (без счётчиков), комиссия 30%, залог 70 000 ₽","Большой Саввинский переулок, 16",м. Спортивная,р-н Хамовники,ЦАО,"Cдaётcя уютнaя 1-кoмнaтная квартира полуcтудия в рaйоне Xамовники, полноcтью укoмплeктoвaннaя тeхникой и мебeлью, метpо Cпoртивнaя или Киeвcкая.

Aдpес: Большoй Сaввинский пepеулoк, д. 16, 2 этaж, eсть балкoн (окна вo двоp). Дo метрo 15 минут пeшкoм. Мнoгo пpодуктoвыx мaгазинoв пo дoрoгe. Закрытый двор для парковки автомобиля без доп оплаты (предоставляется метка ключ для открывания шлагбаума)

Из техники: газ.плита с духовкой, вытяжка, широкоформатная посудомоечная машина, микроволновка, большой высокий холодильник, кондиционер, стиральная машинка (вертикальная загрузка), большой бойлер, душевая кабина, телевизор с тв-приставкой, интернет модем/роутер, видеозвонок

Из мебели: угловой раздвижной диван Икеа, полноценный шкаф-купе из трёх отделений с зеркалами, шкаф для книг в комплексе со стенкой с полками Икеа, в прихожей входной комплекс со шкафом, на окнах ролл шторы блэкаут (не пропускают солнечный свет), входная дверь с шумоизоляцией. Застекленный балкон как доп пространство по Вашему усмотрению, удобно для курящих

Метраж: 35м2. Стоимость 70000 + вода гор и хол, электричество, интернет/тв + залог. Залог можно разбить на 2 месяца. Только на долгий срок. Дети и животные обговариваются в каждом отдельном случае, в зависимости от состава. Оперативный показ.

Рассмотрим порядочных, аккуратных, платёжеспособных.",-2500.0,0.7846000000000001,-2 500 ₽/мес.
315581814,https://www.cian.ru/rent/flat/315581814/,"2-комн. квартира, 50 м², 4/9 этаж",2025-03-29 00:00:00,,5,90 000 ₽/мес.,89 000 ₽/мес,1 000 ₽/мес.,1000.0,"От года, комм. платежи включены (без счётчиков), комиссия 50%, залог 90 000 ₽","Смоленская улица, 10",м. Смоленская,р-н Арбат,ЦАО,"Хорошее состояние квартиры, большие изолированные комнаты, есть вся необходимая техника.
Добротный сталинский дом, отличная шумоизоляция. 
Состав обсуждается",,4.2269,new
314717237,https://www.cian.ru/rent/flat/314717237/,"1-комн. апартаменты, 22 м², 6/6 этаж",2025-03-29 00:00:00,,0,85 000 ₽/мес.,86 000 ₽/мес,-1 000 ₽/мес.,-1000.0,"На несколько месяцев, комм. платежи включены (без счётчиков), комиссия 50%, залог 85 000 ₽","улица Большая Молчановка, 23С2",м. Смоленская,р-н Арбат,ЦАО,"Предлагаются 1-ком. Апартаменты в историческом центре Москвы Новый Арбат. Укомплектованы Мебелью и Техникой (кровать, шкаф,стол,стулья,телевизор, встроенная кухня, холодильник,микроволновая печь, стиральная машинка с функцией сушка, кондиционер) все для комфортного проживания.В доме есть лифт. Стихийная парковка. Развитая инфраструктура: в шаговой доступности - кафе и рестораны, магазины, салоны красоты, отделения банков и фитнес-центры, а также известные музеи и театры. Рядом знаменитый Старый Арбат, Красная площадь - в 25 минутах ходьбы. Удобный выезд на Садовое кольцо. Без животных. Рассматриваем платежеспособных клиентов. Залог можно разделить на два месяца.  Готовы сдать на 6 месяцев.",-5000.0,4.06,-5 000 ₽/мес.
315585856,https://www.cian.ru/rent/flat/315585856/,"1-комн. квартира, 32 м², 3/8 этаж",2025-03-29 00:00:00,,2,100 000 ₽/мес.,95 000 ₽/мес,-5 000 ₽/мес.,-5000.0,"От года, комм. платежи включены (без счётчиков), комиссия 60%, залог 100 000 ₽","Комсомольский проспект, 9",м. Парк Культуры,р-н Хамовники,ЦАО,"Сдается однокомнатная квартира с дизайнерским Евроремонтом, в кирпичном доме с огороженной территорией. Встроенный кухонный гарнитур  со встроенной техникой, холодильник. В комнате диван, журнальный столик, стол обеденный, очень вместительный встроенный шкаф, телевизор, тумба под ТВ, кондиционер. Санузел совмещенный, душевая кабина, стиральная машина. Чистый подъезд, недавно выполнен качественный ремонт. Сдается на длительный срок, БЕЗ ЖИВОТНЫХ.",,4.34,new
315523211,https://www.cian.ru/rent/flat/315523211/,"1-комн. квартира, 38 м², 7/12 этаж",2025-03-28 00:23:00,,8,85 000 ₽/мес.,82 000 ₽/мес,3 000 ₽/мес.,3000.0,"От года, комм. платежи включены (без счётчиков), комиссия 50%, залог 85 000 ₽","улица Льва Толстого, 7",м. Парк Культуры,р-н Хамовники,ЦАО,"Сдам уютную однокомнатную квартиру, кирпичный дом, в центре Москвы, р-н Хамовники, ул. Льва Толстого, д.7. Чистая, аккуратная квартира, современный ремонт, полностью обставлена и обустроена необходимой мебелью и техникой для комфортного проживания. Кухонный гарнитур встроенный, холодильник, варочная панель и духовой шкаф, СВЧ, стиральная машина автомат.  Много мест для хранения, установлен кондиционер. С/у раздельный. 
В шаговой доступности школы, магазины, кафе, рестораны, парки: парк Усадьба Трубецких, Парк Новодевичьи Пруды, Фрунзенская набережная, Парк Горького и др. 
Пешая доступность до метро Парк культуры и Фрунзенская . 
 . Оперативный показ и заселение.
-----
Примечание: у собственника могут быть дополнительные пожелания к жильцам - обсудите их в чате или по телефону",,2.9634,new
315564173,https://www.cian.ru/rent/flat/315564173/,"1-комн. квартира, 36 м², 8/12 этаж",2025-03-28 00:00:00,,1,80 000 ₽/мес.,65 000 ₽/мес,15 000 ₽/мес.,15000.0,"От года, комм. платежи включены (без счётчиков), комиссия 50%, залог 80 000 ₽","улица Усачева, 25",м. Спортивная,р-н Хамовники,ЦАО,"Предлагается однокомнатная квартира в 2-3 минутах ходьбы от метро ""Спортивная"". Жилая комната располагает вместительным шкафом, угловым диваном и кроватью. Кухня оснащена классическим гарнитуром и комплектом бытовой техники, включая духовую и микроволновую печи. Установлена стиральная машина. Имеется балкон с видом на тихий двор.

В пешем доступе расположены сетевые магазины, аптеки и поликлиники, в том числе детская, средние и высшие учебные заведения, отделения банков, салоны красоты, фитнес-клубы. Для прогулок - парки Новодевичьи пруды, Нескучный сад, Воробьевы горы. Удобный выезд на ТТК и Комсомольский проспект.

 - Страховой депозит можно оплатить 2-мя частями.
 - Квартиру представляет агент Capital Mars - Евгения.
 - ID объекта 137392.",,2.5236,new
315560950,https://www.cian.ru/rent/flat/315560950/,"2-комн. квартира, 37,3 м², 8/9 этаж",2025-03-28 00:00:00,,0,100 000 ₽/мес.,129 000 ₽/мес,29 000 ₽/мес.,29000.0,"От года, комм. платежи включены (без счётчиков), комиссия 100%, без залога","улица Большая Якиманка, 56",м. Парк Культуры,р-н Якиманка,ЦАО,"Предлагается в аренду светлая квартира в историческом центре Москвы!
Удобная транспортная развязка, в непосредственной близости от Садового кольца, ул. Б. Якиманка, а так же в пешей доступности до М. Полянка, Октябрьская, Третьяковская, М. Парк Культуры.
Развитая инфраструктура района: магазины, кафе, рестораны, музеи, театры, представительства российских и иностранных компаний.
Квартира полностью меблирована и оснащена бытовой техникой и всем необходимым для жизни.
Никогда не сдавалась , свежий ремонт",,4.25,new
314011077,https://www.cian.ru/rent/flat/314011077/,"1-комн. квартира, 47 м², 5/9 этаж",2025-03-27 11:46:00,,9,90 000 ₽/мес.,67 000 ₽/мес,23 000 ₽/мес.,23000.0,"От года, комм. платежи включены (без счётчиков), без комиссии, залог 90 000 ₽","Ружейный переулок, 4С1",м. Смоленская,р-н Хамовники,ЦАО,"Предлагается однокомнатная квартира в пешей доступности от метро Смоленская. Квартира меблирована качественной мебелью 2000-х годов, недавно был сделан косметический ремонт, куплена новая техника на кухню. 
В комнате и на кухне установлены кондиционеры. В комнате раскладывающийся в двуспальное место диван. Окна выходят на Ружейный переулок. 
Рассматриваем арендаторов на длительный срок, не курящих, только взрослых (1-2 человека), без детей и домашних питомцев.",-5000.0,2.4963,-5 000 ₽/мес.
315445673,https://www.cian.ru/rent/flat/315445673/,"1-комн. квартира, 34,8 м², 12/14 этаж",2025-03-27 00:00:00,,1,70 000 ₽/мес.,67 000 ₽/мес,3 000 ₽/мес.,3000.0,"От года, комм. платежи включены (без счётчиков), комиссия 70%, залог 70 000 ₽","улица Усачева, 40",м. Спортивная,р-н Хамовники,ЦАО,"Сдаётся уютная однокомнатная квартира в Москве. Дом построен в 1973 году из прочного блочного материала. Высота потолков — 2,5 метра. До станции метро ""Спортивная"" всего 7 минут пешком. 

Квартира полностью готова к проживанию: недавно выполнен косметический ремонт. В комнате и на кухне есть необходимая мебель. Так же есть гардеробная.Вся необходимая техника в наличии: холодильник и стиральная машина. Санузел совмещённый, с ванной. Из окон открывается вид на тихий двор. 

Дом оборудован двумя пассажирскими лифтами. 

Район обжитой и удобный для жизни: поблизости находятся школы, детские сады, клиники и магазины. Всё необходимое для комфортной жизни — в шаговой доступности. Хорошая транспортная доступность позволяет быстро добраться до других районов Москвы.
Звоните, оперативный показ!",-5000.0,1.7504000000000002,-5 000 ₽/мес.
315468710,https://www.cian.ru/rent/flat/315468710/,"1-комн. квартира, 44,4 м², 2/6 этаж",2025-03-27 00:00:00,,3,50 000 ₽/мес.,62 000 ₽/мес,-12 000 ₽/мес.,-12000.0,"На несколько месяцев, комм. платежи включены (без счётчиков), комиссия 50%, залог 25 000 ₽","Украинский бульвар, 8К2",м. Смоленская,р-н Дорогомилово,ЗАО,"Сдается уютная однокомнатная квартира в 8 минутах пешком от метро Киевская. Квартира расположена на 2-м этаже 6-этажного дома, окна выходят во двор, что создаёт тишину и уединение.

В квартире выполнен косметический ремонт, есть вся необходимая мебель на кухне и в комнате. Для вашего комфорта установлены холодильник, телевизор и стиральная машина.  Отдельный санузел обеспечивает дополнительное удобство. Доступен интернет, мусоропровод также в наличии.

Дом оснащен пассажирским лифтом и наземной парковкой, поэтому можно без проблем припарковать автомобиль. Жилое здание находится в хорошем состоянии, подъезд чистый и ухоженный.

В шаговой доступности находятся школы, детские сады и магазины, что делает это место идеальным для комфортной жизни. Прекрасная транспортная доступность позволяет быстро добраться до центра города и других районов. Предложение для ОДНОГО человека, квартира сдается на 6 месяцев, возможна пролонгация на длительный срок.",,4.5118,new
252768481,https://www.cian.ru/rent/flat/252768481/,"1-комн. квартира, 43 м², 3/13 этаж",2025-03-26 20:40:00,,9,90 000 ₽/мес.,88 000 ₽/мес,2 000 ₽/мес.,2000.0,"От года, комм. платежи включены (без счётчиков), комиссия 50%, залог 90 000 ₽","Гагаринский переулок, 21",м. Кропоткинская,р-н Хамовники,ЦАО,"Сдается 1-комн. кв-ра в Центре, в пешей доступности от метро Кропоткинская. Имеется вся необходимая мебель и техника. Огороженная территория (вход по коду), бесплатная парковка. Дом был построен для работников ЦК. Очень толстые стены. Великолепная звукоизоляция. В пешей доступности продуктовые и хозяйственный магазин, кафе и рестораны. Рассмотрим одиночек или семейную пару без детей и животных.",-5000.0,3.4865,-5 000 ₽/мес.
314019589,https://www.cian.ru/rent/flat/314019589/,"1-комн. квартира, 32 м², 3/9 этаж",2025-03-26 19:31:00,,9,70 000 ₽/мес.,70 000 ₽/мес,0 ₽/мес.,0.0,"От года, комм. платежи включены (без счётчиков), комиссия 50%, залог 70 000 ₽","улица Большая Якиманка, 56",м. Парк Культуры,р-н Якиманка,ЦАО,"Однокомнатная квартира у метро Октябрьская. Исторический центр города, развитая инфраструктура. Комфортный 3-й этаж, вид во двор. В квартире есть вся необходимая мебель для комфортного проживания. Стиральная машинка, холодильник, кондиционер, эл. чайник, газовая плита (2 конфорки). Сан. узел и сантехника в прекрасном состоянии. Спальное место - кровать. Аренда на длительный срок. Без животных. Без вредных привычек. Для 1-2-х человек. Квартира свободна - возможно оперативное заселение. Показы по согласованию. Звоните. Если вам не удалось дозвониться - напишите сообщение, мы обязательно свяжемся с вами и ответим на все интересующие вас вопросы.",-8000.0,5.0358,-8 000 ₽/мес.
287756063,https://www.cian.ru/rent/flat/287756063/,"1-комн. квартира, 33 м², 11/12 этаж",2025-03-26 16:45:00,,10,75 000 ₽/мес.,75 000 ₽/мес,0 ₽/мес.,0.0,"От года, комм. платежи включены (без счётчиков), комиссия 50%, залог 75 000 ₽","улица Усачева, 25",м. Спортивная,р-н Хамовники,ЦАО,"1-комнатная квартира в панельном доме после капитального ремонта. 
Ремонт евростандарт, на полу плитка, стены-обои, стеклопакеты, видовая на стадион Лужники, 1 с/у совмещ. (ванна).
Встроенная кухня, вся необходимая бытовая техника, мебель икея, 1 балкон (застеклен).
Хороший подъезд, 2 лифта, видеодомофон, дом не огорожен, парковка стихийная.",25000.0,2.5236,25 000 ₽/мес.
314676517,https://www.cian.ru/rent/flat/314676517/,"2-комн. квартира, 42,4 м², 5/8 этаж",2025-03-26 00:00:00,,1,89 990 ₽/мес.,108 000 ₽/мес,-18 010 ₽/мес.,-18010.0,"От года, комм. платежи включены (без счётчиков), комиссия 40%, залог 90 000 ₽","Комсомольский проспект, 11",м. Парк Культуры,р-н Хамовники,ЦАО,"КРОВАТЬ В КВАРТИРУ БУДЕТ ПРИОБРЕТАТЬСЯ ПОД АРЕНДАТОРА
Сдается  уютная, с хорошим ремонтом 2-комнатная квартира в самом сердце Москвы,  в престижном районе Хамовники по адресу: улица Проспект Комсомольский, дом 11.  Просторная  кухня совмещена с гостиной. Спальня, выполненная  в теплых постельных тонах, создает атмосферу комфорта и уюта. Высота потолков — 2.64 метра. В квартире есть вся необходимая мебель и техника для комфортного проживания. Санузел совмещенный, отделан современными материалами. Окна выходят во двор. Имеется небольшая  открытый балкон.
Парковка  автотранспорта  во дворе дома.  Въезд через шлагбаум. 
В пешей доступности находится самый известный парк, излюбленное  место  отдыха  москвичей - Парк Горького. 

Район ""Хамовники""  со своей неповторимой историей , тихий,  с развитой инфраструктурой.  
В шаговой доступности  от дома, расположены школы, детские сады, клиники, магазины, бассейны , музеи. Район прекрасно подходит для семей с детьми. 
 Отличная транспортная доступность. Рядом расположены три станции метро: Парк Культуры,  Фрунзенская,  Октябрьская.  До станции  метро ""Парк Культуры"" всего 7  минут пешком, что делает поездки по городу быстрыми и удобными.
Квартира готова к просмотрам.  Рассмотрим порядочных людей, семью или одиночек без вредных привычек.

Приглашаем вас на просмотр! Записывайтесь на удобное для вас время и убедитесь  сами в привлекательности этого предложения.",-5000.0,3.8321,-5 000 ₽/мес.
