offer_id,offer_url,updated_time,title,price,price_info,address,metro_station,neighborhood,district,description,distance,price_value,rental_period,utilities_type,commission_info,deposit_info,commission_value,deposit_value,status,unpublished_date
315399988,https://www.cian.ru/rent/flat/315399988/,2025-04-16 15:34:00,"1-комн. квартира, 35 м², 19/24 этаж",100 000 ₽/мес.,"От года, комм. платежи включены (без счётчиков), комиссия 70%, залог 100 000 ₽","улица Новый Арбат, 10",м. Арбатская,р-н Арбат,ЦАО,"Арт. 98973579 Стильная и комфортабельная однокомнатная квартира с потрясающим видом на Новый Арбат!

Квартира с дизайнерским качественным ремонтом, НЕ студия, полноценная однокомнатная квартира с гардеробной. Продумывалась для жизни и для себя, для получения удовольствия от жизни . 

Кухня. Современная просторная, 9м2, где есть вся бытовая техника - посудомоечная машина, холодильник, варочная панель, вытяжка. Вся техника - Bosch. Кондиционер. Стильная, светлая, просторная.
 
Коридор с удобной входной группой - шкаф, места для хранения обуви и верхней одежды.

Жилая зона, комната. В комнате выделен огромный шкаф-купе, целая Нарния, практически отдельная гардеробная, который вмещает все вещи, освобождая пространство для жизни. Уютная зона отдыха - просторная и уютная, с телевизором и кондиционером. Большой раскладывающий диван, рабочий стол, стеллаж.  

В ванной комнате сантехника Grohe, душевая кабина, стиральная машина, шкафчики.

В квартире есть все, что вы видите на фотографиях - мебель и техника, элементы дизайна, кухонная утварь (минимальный набор).  Идеальная квартира для жизни, ничего приобретать не надо, заезжай и живи.

Ремонт выполнен из качественных материалов: окна-стеклопакеты с тройным пакетом обеспечивают прекрасную шумоизоляцию. 

Ну и главная изюминка нашей квартиры - панорамные окна на Новый Арбат. Вы будете наслаждаться вдохновляющим видом на центр столицы без шума и пыли ( в квартире два кондиционера и тройные стеклопакеты!)

Дом с круглосуточной охраной и системой видеонаблюдения в подъезде, большой входной группой. В доме 2 лифта. За домом есть небольшая парковка. 

Локация: 5-7 минут до метро Арбатская, Смоленская, Александровский сад, Боровицкая. Напротив дома спортзал сети DDX, магазины, рестораны, кинотеатры. 

Видеообзоры отправляем по запросу, показы по договоренности в любое время. 
Готовы к подписанию договора с понравившимся арендатором. 

Квартира в идеальном состоянии! Ищем жильцов на длинную дистанцию. Рассматриваем молодые пары, небольшие по составу семьи. Без животных.",2.95,100000.0,От года,комм. платежи включены (без счётчиков),комиссия 70%,залог 100 000 ₽,,,active,--
315392787,https://www.cian.ru/rent/flat/315392787/,2025-04-16 13:38:00,"2-комн. квартира, 43 м², 4/9 этаж",90 000 ₽/мес.,"От года, комм. платежи включены (без счётчиков), комиссия 30%, залог 90 000 ₽","2-я Фрунзенская улица, 10",м. Фрунзенская,р-н Хамовники,ЦАО,"Сдается двухкомнатная квартира, состоящая из кухни-гостиной и отдельной просторной спальни. В кухне-гостиной: кухонный гарнитур, плита, вытяжка, холодильник, посудомоечная машина, СВЧ, вытяжной вентилятор, раскладывающийся стол, стулья, стеллаж с телевизором, шкафчики для вещей, диван-книжка, журнальный столик, кондиционер. В спальне: двуспальная кровать, две тумбочки, два вместительных платяных шкафа с зеркальным фасадом. Из спальни есть выход на балкон (не застеклен). Санузел: большой, совмещенный, облицован плиткой, ванна, стиральная машина-автомат с сушкой, водонагреватель, вытяжной вентилятор. В квартире выполнен качественный ремонт: плитка и ламинат на полу, пластиковые окна Rehau, москитные сетки, жалюзи от солнца. Все четыре окна выходят во двор. Закрывающийся тамбур на две квартиры. Пассажирский лифт, в подъезде свежий косметический ремонт. Отличная инфраструктура: в пешей доступности магазины, кафе, школы, поликлиника, Фрунзенская набережная, пешеходный мост в Парк Горького и Нескучный сад и т.д. Высокая транспортная доступность: всего 4-5 минут пешком до метро Фрунзенская, удобный заезд через Садовое и Третье транспортное кольцо, Фрунзенскую набережную и Комсомольский проспект. Для одного-двух человек, без животных.",1.91,90000.0,От года,комм. платежи включены (без счётчиков),комиссия 30%,залог 90 000 ₽,,,active,--
315391921,https://www.cian.ru/rent/flat/315391921/,2025-04-17 12:22:00,"3-комн. квартира, 60 м², 5/5 этаж",95 000 ₽/мес.,"От года, комм. платежи включены (без счётчиков), комиссия 35%, залог 70 000 ₽","улица Красина, 13",м. Баррикадная,р-н Пресненский,ЦАО,"Сдается чистая, только после косметического ремонта просторная трехкомнатная квартира площадью 60 кв. м на пятом этаже пятиэтажного дома без мебели. Квартира находится в шаговой доступности от метро ""Маяковская"" — всего 10 минут пешком. Жилая площадь составляет 45 кв. м, кухня — 6.5 кв. м.

Дом в хорошем состоянии, с наземной парковкой, заезд через шлагбаум бесплатно для одного автомобиля. Благодаря этому вам не придется беспокоиться о месте для машины.

Рядом с домом находятся все необходимые объекты инфраструктуры: школы, детские сады, клиники и магазины. Все это делает проживание здесь комфортным и удобным. Транспортная доступность позволяет легко добраться до любого уголка города.

Квартира сдается на длительный срок. Условия сделки: требуется залог и предоплата.  Квартира идеально подходит для семьи или компании из нескольких человек.",4.16,95000.0,От года,комм. платежи включены (без счётчиков),комиссия 35%,залог 70 000 ₽,,,active,--
315378243,https://www.cian.ru/rent/flat/315378243/,2025-04-11 15:59:00,"1-комн. квартира, 55 м², 4/6 этаж",100 000 ₽/мес.,"От года, комм. платежи включены (без счётчиков), без комиссии, залог 100 000 ₽","Пятницкая улица, 62С7",м. Октябрьская,р-н Замоскворечье,ЦАО,Качественный ремонт. Полностью укомплектована мебелью и бытовой техникой.,4.62,100000.0,От года,комм. платежи включены (без счётчиков),без комиссии,залог 100 000 ₽,,,active,--
315351421,https://www.cian.ru/rent/flat/315351421/,2025-04-11 21:09:00,"2-комн. квартира, 47 м², 1/6 этаж",90 000 ₽/мес.,"От года, комм. платежи включены (без счётчиков), комиссия 70%, залог 90 000 ₽","Украинский бульвар, 8К2",м. Киевская,р-н Дорогомилово,ЗАО,"Сдается 2-х комнатная квартира со своим ПАРКОВОЧНЫМ МЕСТОМ во дворе!

5 мин пешком до м. КИЕВСКАЯ

Вся техника в наличии, включая кондиционер и посудомоечную машину!
Телевизор и спальное место в большую комнату собственник по запросу предоставит.

Можно с детьми, животные обсуждаются!

При заезде необходимо оплатить: 90т аренда + 90т залог (можно разбить на 2 платежа) + 70% комиссия агентства.",1.88,90000.0,От года,комм. платежи включены (без счётчиков),комиссия 70%,залог 90 000 ₽,,,active,--
315318393,https://www.cian.ru/rent/flat/315318393/,2025-03-31 11:40:00,"2-комн. квартира, 42 м², 3/5 этаж",65 000 ₽/мес.,"От года, комм. платежи включены (без счётчиков), без комиссии, залог 65 000 ₽","Духовской переулок, 20кБ",м. Шаболовская,р-н Даниловский,ЮАО,"Строго не курящие арендаторы.
Сдается квартира от собственника.
Риелторов просьба не беспокоить!
Квартира полностью готова к проживанию. Укомплектована ( микроволновка, телевизор, утюг, стиральная машина, холодильник, пылесос). Удобный третий этаж, тихий двор. В квартире чисто, свежий ремонт был проведен летом 2023 года.
-----
Примечание: у собственника могут быть дополнительные пожелания к жильцам - обсудите их в чате или по телефону",5.67,65000.0,От года,комм. платежи включены (без счётчиков),без комиссии,залог 65 000 ₽,,,active,--
315317778,https://www.cian.ru/rent/flat/315317778/,2025-04-13 11:45:00,"2-комн. квартира, 52 м², 8/14 этаж",100 000 ₽/мес.,"От года, комм. платежи включены (без счётчиков), комиссия 20%, залог 100 000 ₽","улица Павла Андреева, 4",м. Шаболовская,р-н Замоскворечье,ЦАО,"Чистая, уютная квартира в доме бизнес-класса в районе Замоскворечья. Полностью меблирована, кондиционер, бойлер, застекленная лоджия из спальни. Пассажирский и грузовой лифт. Закрытый двор, въезд через шлагбаумы. Парковка во дворе для жителей дома. Рядом три метро: Серпуховская, Добрынинская, Шаболовская. Вся необходимая инфраструктура в пределах пешей досягаемости: банки, магазины, ТРЦ"" Ереван-Плаза"", поликлиники, больница, фитнес- клубы, почта, Даниловский и Донской монастыри, рынок. Удобная транспортная доступность. Показ в удобное время (ключи).",4.94,100000.0,От года,комм. платежи включены (без счётчиков),комиссия 20%,залог 100 000 ₽,,,active,--
315314993,https://www.cian.ru/rent/flat/315314993/,2025-04-13 20:17:00,"2-комн. квартира, 45 м², 4/5 этаж",90 000 ₽/мес.,"От года, комм. платежи включены (без счётчиков), комиссия 45%, залог 90 000 ₽","2-я Рощинская улица, 3",м. Шаболовская,р-н Даниловский,ЮАО,"светлая и тихая квартира 
вид в тихий двор

балкон в спальне 
гардеробная
кондиционер 
бойлер
хорошая шумоизоляция

страховой депозит можно разбить на 2 месяца
оперативные показы - свободна к заселению!",5.14,90000.0,От года,комм. платежи включены (без счётчиков),комиссия 45%,залог 90 000 ₽,,,active,--
315313431,https://www.cian.ru/rent/flat/315313431/,2025-04-07 14:41:00,"Студия, 20 м², 1/5 этаж",65 000 ₽/мес.,"От года, комм. платежи включены (счётчики включены), комиссия 100%, залог 65 000 ₽","Стрельбищенский переулок, 22А",м. Улица 1905 года,р-н Пресненский,ЦАО,"ЗАЛОГ МОЖНО РАЗБИТЬ по договорённости.                               
Предлагается просторная квартира в тихом и благополучном районе!                               
                                   
Сдается просторная студия на последнем этаже дома с Новым Косметическим ремонтом, большая кухня, очень удобная планировка.                               
 Вся мебель и техника для комфортного проживания имеется, за исключением спальных мест.                                
В квартире имеется вся необходимая техника, кухонный гарнитур, обеденная зона, и тд.                              
Квартира светлая, уютная, вся техника и мебель новые.                               
Чистый дом и подъезд. Экологически чистый район с развитой инфраструктурой.                               
 Расположенность, в доме есть небольшой магазин со всем необходимым.                               
Рядом школа, детский сад, поликлиника.,в шаговой доступности, всё, что нужно для жизни.                               
МЕТРО в пешей доступности!                               
                               
Оперативный показ.                               
Заселение день в день!                               
По всем вопросам звонить 24/7.",4.83,65000.0,От года,комм. платежи включены (счётчики включены),комиссия 100%,залог 65 000 ₽,,,active,--
315312357,https://www.cian.ru/rent/flat/315312357/,2025-03-23 17:01:00,"2-комн. квартира, 47,6 м², 8/12 этаж",70 000 ₽/мес.,"От года, комм. платежи включены (без счётчиков), комиссия 50%, залог 70 000 ₽","Ходынская улица, 10С1",м. Улица 1905 года,р-н Пресненский,ЦАО,"Сдаётся уютная двухкомнатная квартира в десяти минутах пешком от метро ""Улица 1905 года"". Общая площадь составляет 47,6 кв. м, из которых 32 кв. м — жилая площадь, а кухня занимает 9 кв. м. Квартира расположена на 8 этаже 12-этажного дома, окна выходят на улицу.

В квартире сделан косметический ремонт, есть вся необходимая мебель и техника для комфортного проживания: холодильник, телевизор, стиральная машина. Планировка включает две комнаты и кухню, а также ванную комнату с ванной. Санузел раздельный. В квартире два балкона, где можно наслаждаться свежим воздухом и видом на город.

Дом оборудован двумя пассажирскими лифтами, что удобно для жителей. Для автомобилей предусмотрена наземная парковка. В подъезде есть пандус для удобства. Мусоропровод функционирует, поэтому можно легко избавляться от отходов.

Район с развитой инфраструктурой: поблизости находятся школы, детские сады и магазины. Удобная транспортная доступность до центра города — метро всего в 10 минутах пешком.

Условия аренды:  Предоплата за первый месяц и залог + комиссия агента. Идеально подойдёт для пары или небольшой семьи. Животные обсуждаются отдельно.

Записывайтесь на просмотр, чтобы оценить все преимущества этой квартиры лично!",5.05,70000.0,От года,комм. платежи включены (без счётчиков),комиссия 50%,залог 70 000 ₽,,,active,--
315309328,https://www.cian.ru/rent/flat/315309328/,2025-04-09 13:19:00,"1-комн. квартира, 33 м², 6/9 этаж",70 000 ₽/мес.,"От года, комм. платежи включены (без счётчиков), комиссия 45%, залог 70 000 ₽","Звенигородское шоссе, 3АС1",м. Улица 1905 года,р-н Пресненский,ЦАО,"Компактная, удобная однокомнатная квартира после свежего косметического ремонта, новый диван и кровать, окна - двор. Теплый кирпичный дом. Замечательное месторасположение - все рядом, метро реально 5мин., чистый подъезд. Без детей. Без животных.
Примечание: у собственника могут быть дополнительные пожелания к жильцам - обсудите их в чате.",7.39,70000.0,От года,комм. платежи включены (без счётчиков),комиссия 45%,залог 70 000 ₽,,,active,--
315304762,https://www.cian.ru/rent/flat/315304762/,2025-04-15 22:35:00,"2-комн. квартира, 40 м², 7/9 этаж",75 000 ₽/мес.,"От года, комм. платежи включены (без счётчиков), комиссия 50%, залог 75 000 ₽","улица Красная Пресня, 8",м. Краснопресненская,р-н Пресненский,ЦАО,"Сдается двухкомнатная квартира на длительный срок! В самом сердце столицы!

Пешая доступность от станций метро Краснопресненская (5 минут), 1905 года, Баррикадная и т.д.

В квартире имеется все необходимое для жизнедеятельности: кровать, диван, кухонный гарнитур, холодильник, стиральная машина, микроволновая печь, обеденная группа, шкаф для хранения вещей.

Ищем порядочных и платежеспособных  жильцов на длительный срок! Строго без животных! Квартира отлично подойдет для одного или двух человек.

Оплата по счетчикам (электричество и водоснабжение).

Квартира свободна. Оперативный показ! Быстрое заселение!

Звонить с 9:00 до 21:00",3.46,75000.0,От года,комм. платежи включены (без счётчиков),комиссия 50%,залог 75 000 ₽,,,active,--
315288828,https://www.cian.ru/rent/flat/315288828/,2025-04-03 11:36:00,"1-комн. квартира, 37 м², 4/8 этаж",60 000 ₽/мес.,"От года, комм. платежи включены (без счётчиков), комиссия 100%, залог 60 000 ₽","Васильевская улица, 9",м. Баррикадная,р-н Пресненский,ЦАО,"Светлая квартира в обычном жилом состоянии, очень скромненько, но чисто. Мебель, бытовая техника имеется. Спальное место (двухспальная кровать с ортопедическим матрасом)- новые. 
 Паркет в хорошем состоянии. Балкон просторный-застеклен. Удачное расположение дома, скрыт от шума и суеты, и в тоже время все в шаговой доступности, в том числе метро. Много зелени.",4.71,60000.0,От года,комм. платежи включены (без счётчиков),комиссия 100%,залог 60 000 ₽,,,active,--
315281699,https://www.cian.ru/rent/flat/315281699/,2025-04-15 14:53:00,"1-комн. квартира, 30 м², 8/8 этаж",80 000 ₽/мес.,"От года, комм. платежи включены (без счётчиков), комиссия 50%, залог 80 000 ₽","Большой Кондратьевский переулок, 8С1",м. Баррикадная,р-н Пресненский,ЦАО,"Предлагается 1-комнатная квартира общей площадью 30 м² недалеко от станции метро ""Белорусская"". Для комфортного проживания в наличии имеется вся необходимая мебель. Для удобства организована гардеробная комната. Из дополнительных преимуществ - наличие балкона. Окна обращены на улицу.

 - Страховой депозит можно оплатить 2-мя частями.
 - Можно с детьми.

 - Объект представляет агент Capital Mars - Артем.
 - ID объекта 767519.",4.87,80000.0,От года,комм. платежи включены (без счётчиков),комиссия 50%,залог 80 000 ₽,,,active,--
