offer_id,offer_url,updated_time,title,price,price_info,address,metro_station,neighborhood,district,description,distance,price_value,rental_period,utilities_type,commission_info,deposit_info,commission_value,deposit_value,status,unpublished_date
313007740,https://www.cian.ru/rent/flat/313007740/,2025-03-29 20:01:00,"1-комн. квартира, 31,5 м², 5/5 этаж",70 000 ₽/мес.,"На несколько месяцев, комм. платежи включены (без счётчиков), без комиссии, залог 70 000 ₽","Поклонная улица, 8",м. Студенческая,р-н Дорогомилово,ЗАО,"От собственника, без комиссии. Сдается уютная 1-ая комнатная квартира на длительный срок (от полугода), со всей мебелью и техникой. 1-2 человека, без детей и животных. 5 минут от ст. м. Кутузовская, в шаговой доступности парк Победы и ст. м, Студенческая. Вся необходимая инфраструктура рядом (супермаркеты, кафе и рестораны). Договор аренды заключается. Страховой депозит 100%.",4.2,70000.0,На несколько месяцев,комм. платежи включены (без счётчиков),без комиссии,залог 70 000 ₽,,,active,--
312831527,https://www.cian.ru/rent/flat/312831527/,2025-04-09 19:03:00,"1-комн. квартира, 38 м², 10/12 этаж",80 000 ₽/мес.,"От года, комм. платежи включены (без счётчиков), без комиссии, залог 80 000 ₽","Большая Декабрьская улица, 4",м. Улица 1905 года,р-н Пресненский,ЦАО,"Сдается в центре Москвы в 1 мин. пешком от метро 1905 года однокомнатная квартира. Объявление от собственника. Без комиссии. Контактное лицо-Василий. Сдается на длительный срок. Удобная транспортное расположение. Дом с шлагбаумом. В подъезде сидит консьерж. Квартира свежая: с мебелью, с техникой, с интернетом. Фотографии реальные. Рядом есть магазины, детский сад, аптеки, поликлиника. Развитая инфраструктура. Есть балкон, кондиционер. Окна квартиры выходят на тихую сторону. Квитанция и счетчики за квартиросъемщиком. Ищем порядочных, неконфликтных жителей. Звоните. Ответим на все вопросы.",4.8,80000.0,От года,комм. платежи включены (без счётчиков),без комиссии,залог 80 000 ₽,,,active,--
312803227,https://www.cian.ru/rent/flat/312803227/,2025-03-14 18:11:00,"1-комн. квартира, 33 м², 6/8 этаж",82 000 ₽/мес.,"От года, комм. платежи включены (без счётчиков), комиссия 50%, залог 82 000 ₽","Большой Кондратьевский переулок, 12С1",м. Баррикадная,р-н Пресненский,ЦАО,"Уютная, светлая 1-комнатная квартира в самом центре Москвы. Квартира полностью меблирована и готова к проживанию. Стиральная машина и холодильник заказаны собственником, в течение нескольких дней будут установлены. Окна квартиры выходят в тихий двор с приятным видом на окрестности. Из бытовой техники на кухне: посудомоечная машина, варочная панель, вытяжка, холодильник. Развитая инфраструктура района: рестораны, магазины, аптеки - 3-5 мин пешком от дома, удобная транспортная доступность, до м. Белорусская 5 мин пешком. Предпочтение семейной паре или одному человеку.
-----
Примечание: у собственника могут быть дополнительные пожелания к жильцам - обсудите их в чате или по телефону",4.97,82000.0,От года,комм. платежи включены (без счётчиков),комиссия 50%,залог 82 000 ₽,,,active,--
312685160,https://www.cian.ru/rent/flat/312685160/,2025-04-15 14:24:00,"1-комн. квартира, 30,5 м², 2/5 этаж",75 000 ₽/мес.,"От года, комм. платежи включены (без счётчиков), комиссия 15%, залог 75 000 ₽","Студенческая улица, 16",м. Студенческая,р-н Дорогомилово,ЗАО,"Впервые сдаётся уютная однокомнатная квартира в доме с обособленной парковкой за шлагбаумом и моментальным выездом  на Кутузовский проспект в направлении центра.  Выполнен ремонт из качественных материалов. Площадь комнаты составляет 18 м², расположена на втором этаже крепкого пятиэтажного дома. Подъезд после капитального ремонта,  выполнен очень добротно, приятно возвращаться.  Доступ в подъезд возможен с двух сторон - со стороны Кутузовского проспекта и Студенческой улицы - ровно позади станции пожарной охраны. 
Кухня и комната оснащены необходимой мебелью и техникой, включая посудомоечную и стиральную машины, холодильник,  варочную панель, в комнате  большой шкаф для сезонного и повседневного хранения вещей, раздвижной ортопедический, диван и рабочее место со  стульями.  Нетипично просторный санузел с большим зеркалом.  Установлен кондиционер. Вид из окон -  тенистый двор и детская площадка. Квартира также имеет застекленный балкон. 
Развитая инфраструктура престижного,  давно сложившегося района:  в шаговой доступности школы, детские сады и сетевые магазины, Дорогомиловский рынок. 
Имеются причины с сожалением отказать жильцам с животными. 

На долгий срок. 
Договор. Невысокая комиссия. 

Условия: 
Ежемесячная оплата проживания , залоговый платеж, оплата счетчиков.",2.62,75000.0,От года,комм. платежи включены (без счётчиков),комиссия 15%,залог 75 000 ₽,,,active,--
312677059,https://www.cian.ru/rent/flat/312677059/,2025-03-31 17:50:00,"1-комн. квартира, 31 м², 1/5 этаж",80 000 ₽/мес.,"От года, комм. платежи включены (без счётчиков), комиссия 50%, залог 40 000 ₽","Хлебный переулок, 10",м. Арбатская,р-н Пресненский,ЦАО,"Однокомнатная квартира в историческом районе Москвы на против резиденции посла Бельгии на первом этаже пяти этажного дома чисто тихо , показываем по договоренности! Агент Александр! При необходимости может быть предоставлено помещение для хранения вещей 5 кв метров дополнительно!",3.29,80000.0,От года,комм. платежи включены (без счётчиков),комиссия 50%,залог 40 000 ₽,,,active,--
312673761,https://www.cian.ru/rent/flat/312673761/,2025-04-17 13:06:00,"1-комн. квартира, 53 м², 8/8 этаж",81 000 ₽/мес.,"От года, комм. платежи включены (без счётчиков), комиссия 50%, залог 81 000 ₽","Комсомольский проспект, 5/2",м. Парк Культуры,р-н Хамовники,ЦАО,"СРОЧНО! Сдам просторную 1-комнатную квартиру в престижном районе ""Хамовники"". Квартира оборудована всей необходимой для проживания мебелью и техникой. Из окон открывается шикарная панорама на Москву. Тихий и зеленый двор, ухоженный подъезд. Дом сталинский с хорошей шумоизоляцией. Рядом есть вся необходимая инфраструктура: парк ""Музеон"", сквер для прогулок, сетевые продуктовые магазины, театры и места для проведения досуга и отдыха, ТЦ и многое другое. Рассмотрим до 2-х человек, без детей и животных. Звoните прямo сейчaс!

Номер объекта: #1/1268622/109",1.93,81000.0,От года,комм. платежи включены (без счётчиков),комиссия 50%,залог 81 000 ₽,,,active,--
312625442,https://www.cian.ru/rent/flat/312625442/,2025-04-14 15:13:00,"2-комн. квартира, 60 м², 8/10 этаж",100 000 ₽/мес.,"От года, комм. платежи включены (без счётчиков), комиссия 60%, залог 100 000 ₽","Большая Грузинская улица, 42",м. Баррикадная,р-н Пресненский,ЦАО,"Сдается просторная 2-комнатная квартира в теплом кирпичном доме индивидуального проекта. Благоустроенный зеленый двор. Охраняемая огороженная территория с местами для парковки. В квартире выполнен качественный евроремонт. Полный набор мебели и бытовой техники: посудомоечная и стиральная машины, кухонная вытяжка, СВЧ-печь, ТВ, кондиционеры в обеих комнатах. В кухне теплые полы. Панорамный вид из окон-окна на 2 стороны, полуэркер.",4.23,100000.0,От года,комм. платежи включены (без счётчиков),комиссия 60%,залог 100 000 ₽,,,active,--
312606307,https://www.cian.ru/rent/flat/312606307/,2025-04-17 11:25:00,"2-комн. квартира, 58 м², 2/5 этаж",90 000 ₽/мес.,"От года, комм. платежи включены (без счётчиков), комиссия 60%, залог 90 000 ₽","Малая Тульская улица, 2/1К5",м. Шаболовская,р-н Даниловский,ЮАО,"Номер в базе: 4404269. Сдается великолепная двухкомнатная квартира, которая станет идеальным домом для вашей семьи! 

О КВАРТИРЕ:
- Просторные комнаты обеспечат комфорт и уют для жизни, здесь достаточно места для отдыха и работы.
- В квартире имеется вся необходимая мебель и современная бытовая техника: кондиционер для прохлады в жаркие дни, холодильник для хранения продуктов, плита и посудомоечная машина для удобства на кухне, стиральная машина для вашего комфорта.

ЛОКАЦИЯ:
- Всего в 5 минутах пешком находится станция метро Тульская, что обеспечивает легкий доступ к любой части города.
- Удобная транспортная развязка: регулярно курсируют трамваи, а рядом расположены несколько крупных торговых центров, таких как Ереван Плаза, Гагаринский Ашан и Рио, где вы сможете найти все необходимое для комфортной жизни.
- В шаговой доступности находятся аптеки и продуктовые магазины, что делает повседневные покупки быстрыми и удобными.
- Также в непосредственной близости расположены корпуса известных университетов: РГУ им. Косыгина, ВШЭ, РУДН, что делает квартиру отличным вариантом для студентов и преподавателей.

Не упустите шанс жить в комфортной и уютной квартире в центре событий! Звоните прямо сейчас, чтобы записаться на просмотр!


Код пользователя: 108863",5.29,90000.0,От года,комм. платежи включены (без счётчиков),комиссия 60%,залог 90 000 ₽,,,active,--
312606108,https://www.cian.ru/rent/flat/312606108/,2025-04-15 19:16:00,"2-комн. квартира, 45 м², 12/12 этаж",90 000 ₽/мес.,"От года, комм. платежи включены (без счётчиков), без комиссии, залог 90 000 ₽","улица Красная Пресня, 23С1А",м. Улица 1905 года,р-н Пресненский,ЦАО,"Без комиссии! 


Cдетcя 2-комнaтнaя квaртиру в ЦАО в 2х минутaх xодьбы от м. 1905г. или в 7 мин.oт м. Краcнoпрecнeнcкaя. Квартира в хoрошeм cocтoянии,поcлe кocмeтичеcкoгo ремонта .кoмнaты изолиpoвaнныe, с/у раздельный. еcть вся необxoдимая мебель, плaстикoвыe oкнa. Из бытoвoй теxники eсть: телевизор, cтиральная машина, холодильник, пылесос, свч, гладильная доска, микроволновая печь, возможно приобретение посудомоечной машины. Имеется застекленная лоджия, квартира очень теплая. Шикарный вид из окна на ""Москва СИТИ"" . Приличные соседи, консьерж. Внизу дома большой продуктовый и хозяйственный магазин. Залог можно разбить. Можно с детьми и животными",3.78,90000.0,От года,комм. платежи включены (без счётчиков),без комиссии,залог 90 000 ₽,,,active,--
312488327,https://www.cian.ru/rent/flat/312488327/,2025-04-16 22:10:00,"Студия, 17 м², 2/6 этаж",70 000 ₽/мес.,"От года, комм. платежи включены (без счётчиков), без комиссии, залог 70 000 ₽","улица Красина, 7С1",м. Баррикадная,р-н Пресненский,ЦАО,"Предлагаем в аренду 1-к квартиру-студию м. Маяковская, ул. Красина, д. 7к1 на 2/6эт. кирпичного дома. Исторический центр г. Москвы. До метро Маяковская 5 мин пешком. С мебелью и всей техникой (есть холодильник, стиральная машины, кондиционер, СВЧ, теплый пол в санузле).

Дизайнерский ремонт 2024г. Общ. пл. 17м. Комната 10м. Санузел совмещен (душ). Есть стихийный паркинг на огороженной территории.

Жить рядом с Триумфальной площадью становится по-настоящему престижным. В пешей доступности — известные Патриаршие пруды, неспящая Тверская улица, Триумфальная площадь с лавочками и качелями, концертный зал им. Чайковского и театр ""Практика"". В десяти минутах неспешным шагом — Московский зоопарк, театральный кластер на Садовом кольце, сад ""Эрмитаж"". В пешей доступности Музей восковых фигур, Музей современного искусства, музей - квартиры известных личностей, Российский национальный музей музыки и еще много разных локаций для жизни и развлечений. 
В районе представлены высококлассные московские офисные центры, как, например Ducat Place, ""Белая площадь"", ""Белые сады"". Здесь прекрасные школы, в том числе с преподаванием на иностранных языках, и хорошие медицинские учреждения.


Развитая инфраструктура: в пешей доступности магазины, супермаркет, спортивные площадки, прогулочные зоны, фитнес-клубы, банки, кафе, рестораны, торговые центры, музеи, театры и т.п. 

Транспортная доступность: м. Маяковская (7 мин пешком), м. Белорусская, м. Тверская, м. Пушкинская и м. Чеховская (15 мин пешком), м. Охотный ряд и м. Театральная (25 мин пешком), до аэропорта Шереметьево или от Белорусского вокзала, или на авто, или аэроэкспресс 40 минут. В 40 мин выезд на МКАД и СВХ (это прямое продолжение трассы М -11 на Питер), до центра г. Москвы 10 мин на авто.

Рассмотрим 1 чел, можно юр. лицо. Без детей и животных. Обращайтесь, уважаемые клиенты и коллеги. Оперативный показ.",4.04,70000.0,От года,комм. платежи включены (без счётчиков),без комиссии,залог 70 000 ₽,,,active,--
312402876,https://www.cian.ru/rent/flat/312402876/,2025-04-14 10:26:00,"1-комн. квартира, 51 м², 15/37 этаж",83 000 ₽/мес.,"От года, комм. платежи включены (без счётчиков), без комиссии, залог 83 000 ₽","Хорошевское шоссе, 12к1",м. Улица 1905 года,р-н Хорошевский,САО,"Сдаётся на длительный срок квартира после ремонта от собственника. всё необходимое для комфортного проживания имеется. рассмотрим одного человека или пару без детей и животных. 
в пяти минутах ходьбы метро Беговая, в десяти-станция МЦД. в районе есть магазины и торговый центр.",6.27,83000.0,От года,комм. платежи включены (без счётчиков),без комиссии,залог 83 000 ₽,,,active,--
312250093,https://www.cian.ru/rent/flat/312250093/,2025-04-12 12:20:00,"2-комн. квартира, 46 м², 4/5 этаж",75 000 ₽/мес.,"От года, комм. платежи включены (без счётчиков), комиссия 60%, залог 75 000 ₽","Духовской переулок, 20кБ",м. Шаболовская,р-н Даниловский,ЮАО,"Агент Русалина.  Сдается на длительный срок квартира в пешей доступности от метро Тульская. Комнаты смежные. Квартира укомплектована всей необходимой, современной  мебелью для проживания и бытовой техникой. Сан. узел совмещенный.  Рассмотрим НЕ всех желающих, состав обсуждаем. Залог разбиваем. Показ по договоренности. Готова к заселению.",5.67,75000.0,От года,комм. платежи включены (без счётчиков),комиссия 60%,залог 75 000 ₽,,,active,--
312246667,https://www.cian.ru/rent/flat/312246667/,2025-04-03 14:21:00,"2-комн. квартира, 46 м², 11/12 этаж",85 000 ₽/мес.,"От года, комм. платежи включены (без счётчиков), комиссия 60%, залог 85 000 ₽","улица Тимура Фрунзе, 34",м. Парк Культуры,р-н Хамовники,ЦАО,"Светлана. Сдается чистая, уютная квартира в прекрасном районе. На длительный срок. Есть все необходимое для комфортного проживания. СТРОГО БЕЗ ЖИВОТНЫХ.",1.26,85000.0,От года,комм. платежи включены (без счётчиков),комиссия 60%,залог 85 000 ₽,,,active,--
311906207,https://www.cian.ru/rent/flat/311906207/,2025-04-03 12:08:00,"3-комн. квартира, 57 м², 4/5 этаж",70 000 ₽/мес.,"От года, комм. платежи включены (без счётчиков), комиссия 50%, залог 70 000 ₽","Стрельбищенский переулок, 25",м. Улица 1905 года,р-н Пресненский,ЦАО,"Квартира сдается впервые .Мебель наборная, техника вся.",5.48,70000.0,От года,комм. платежи включены (без счётчиков),комиссия 50%,залог 70 000 ₽,,,active,--
311802061,https://www.cian.ru/rent/flat/311802061/,2025-04-12 23:07:00,"1-комн. квартира, 29,5 м², 4/6 этаж",75 000 ₽/мес.,"От года, комм. платежи включены (без счётчиков), без комиссии, залог 20 000 ₽","Шмитовский проезд, 13",м. Улица 1905 года,р-н Пресненский,ЦАО,"Агенты не нужны,  спасибо! свободна с  21 апреля. Хорошее место, косметический ремонт в 22 году, в ванной теплый пол , свет с пульта, ламинат. Я  хозяин, поэтому вы экономите на услугах риэлтора, страховой депозит тоже маленький- 20 тыс. Все рядом, в подьезде хороший ремонт, москва сити и цмт пешком, парк пресня тоже. район очень приятный, низкоэтажная застройка, зеленые дворы,  тихая буржуазная публика Животные в разумных пределах.",4.11,75000.0,От года,комм. платежи включены (без счётчиков),без комиссии,залог 20 000 ₽,,,active,--
